Name,Description,Date,IntensityId,Length,CoachId,GenreIdList,SongIdList,SpotifyLink,WorkoutId,MaxTargets,LocationIdList,WorkoutType,MaxScore,MaxDodges,MaxKneeStrikes,MaxTriangles
Quick Hits Prom Night,"Suit up for Prom Night with Coach Dwana, athlete! Dance the night away in this short-form workout to sock hop and doo-wop throwbacks.",11/14/2021,2,7:12,32,23,"1758, 1760",https://open.spotify.com/playlist/1golTomn2yCgJm4R8HJq6r?si=4478b9af14614b60,1424,758,"47, 69",classic,193,,,138
"Freedom Rock ""The Bright Side""",Tune up your bats and acoustic guitar for Folk-leaning Rock gems from the 1970s. Catch Coach Mark for this light and bright good time.,11/13/2021,1,22:27,33,20,"618, 702, 1654, 1880, 1513, 1041",https://open.spotify.com/playlist/78w2ZJRErOdCeGh3bUV4XE?si=7622cb7e971d4be4,1420,1602,"50, 81, 118, 99, 95, 93",classic,490,,,564
"Meditation ""Love You""",We can be our own worst critics. Work on speaking to yourself as though you were talking to a loved one.,11/13/2021,4,4:24,28,,,,1421,0,,meditation,,,,0
Quick Hits Fresh Finds,Bump up the energy and hit the dance floor with Coach Doc and this current Dance Pop two-pack.,11/14/2021,3,8:26,28,"19, 22","1724, 1723",https://open.spotify.com/playlist/4PvV34its8AU6aQNQ05ivt?si=fef1ae9fcfa54321,1423,1191,"20, 54",classic,349,,,370
"Pros Only ""Bouncy Bass""","Get hype, athlete! Pros Only is our home for higher-than-high intensity workouts. Amp it up with Coach Leanne and a diverse, cross-genre playlist full of aggressive, distorted bass, and punk energy.",11/16/2021,3,20:46,25,"21, 22","845, 816, 1055, 807, 1917, 1918",https://open.spotify.com/playlist/55I8x2qRsQsYjp3xAo78HS?si=ae263182f8054aa4,1359,4057,"16, 5, 61, 56, 45, 67",classic,1081,,,900
"Pop Till You Drop ""Listen & Glisten""",Shine your light bright with Coach Raneir to current Pop music with slick beats and glossy production.,11/15/2021,2,21:59,27,19,"1973, 1956, 443, 1957, 1294, 1958",https://open.spotify.com/playlist/5vgbsarE0cRKVO1cvzfpIr?si=cc20a72b96ed45dd,1392,2435,"115, 106, 63, 66, 113, 17",classic,711,,,746
"Hair Brained ""We're Not Gonna Take It""","Enter the ring with Coach Mark, athlete. You won't be down and out with these these Glam and Hard Rock giants from 1970s and 80s!",11/16/2021,2,15:30,33,20,"1265, 1662, 1137",https://open.spotify.com/playlist/4IwDcW5iWFzwd7aab87a2Z?si=0dc6f7a48f8d48f0,1394,978,"108, 58, 8",boxing,403,542,,1
"Rock The Ages ""Runnin' Wild""","It's time to Rock And Roll All Nite with Coach Mark, athlete! Rock on to this cross-decade playlist packed with a punch of cool.",11/15/2021,1,15:29,33,,"1715, 1561, 1995",https://open.spotify.com/playlist/4m0NaVxF7QA6XOnJ4rpE3E?si=8a7fca4b92ac413f,1298,627,"53, 79, 60",boxing,260,318,,1
"Freedom Rock ""70's Guitar Heroes""",Channel your inner-Rock God(dess) and shred to iconic guitar lines from Classic Rock history. Be a part of the band with Coach Leanne and get down to a playlist featuring broad genre Rock from the 1970s.,11/18/2021,3,26:14:00,25,20,"1024, 314, 1781, 2004, 2005, 2006",https://open.spotify.com/playlist/4LfhmcNnl6imz67NgAFCco?si=cae55425c0344259,1449,4592,"116, 55, 113, 79, 38, 80",classic,1121,,,674
"Strut ""Riff This""","Brace yourself for heavy hits and powerful riffs, athlete! Join Coach Dwana for decade-spanning broad genre Rock from the 70s through today.",11/19/2021,1,18:43,32,20,"626, 1266, 1793, 1081, 1807, 1964",https://open.spotify.com/playlist/66DzueUIRaZdOXA1XQysDG?si=d1cf319fb58d4ba9,1399,1730,"20, 28, 111, 58, 104, 82",classic,444,,,326
"Moment @ Loch Coruisk, Scotland","Take in the inland fresh-water at Loch Coruisk in the Scottish Highlands. Sit down, focus on your breath and take a moment. To enjoy this moment without music, hit the menu button on your left controller to adjust the volume. [Experimental]",11/19/2021,4,10:04,31,,1226,,1516,0,123,meditation,,,,0
"Rap-ture ""Good As Hell""","Baby, how you feeling? Go on, dust your shoulders off to Pop Hip Hop favorites with Coach Doc as your cornerman.",11/17/2021,3,11:37,28,"19, 21","2097, 2009, 236",https://open.spotify.com/playlist/1Ws35mZDhTITMzAzl2j7Zs?si=4a6dd930afb647a9,1482,694,"124, 106, 70",boxing,328,553,,1
"Cover Lover ""Rock My Soul""","We've got you covered, athlete! Let's mash it up and throw it back with Coach Doc as these Old Soul singers stir up Rock Classics and Contemporary Rockers riff on Old Soul.",11/17/2021,1,14:35,28,"20, 23","1246, 1547, 1413, 1841, 401",https://open.spotify.com/playlist/3LAGxwQVlK1R1FTgH2zXiR?si=380a38fb7b14407b,1356,1342,"93, 91, 37, 98, 97",classic,360,,,306
"Meditation ""Grounded""","Take a moment to become centered, grounded in everything you are and everything that surrounds you. Feel the connection that reminds you that you are a part of it all.",11/20/2021,4,4:56,28,,,,1452,0,,meditation,,,,0
"Self Love ""Love Thang""","It's a love thang, athlete! Coach Raneir believes that we're at our most powerful when motivated by love. Join him for this all-out love-fest set to cross-decade Dance and Disco (undoubtedly guaranteed to make you twerk).",11/20/2021,2,23:33,27,"19, 22, 23","1486, 1377, 2032, 2030, 2031, 1829",https://open.spotify.com/playlist/7eGf6WJslGrvqJlHeIqyNZ?si=3ea3e24701b64552,1483,2627,"8, 93, 33, 32, 25, 60",classic,752,,,754
Quick Hits Summer,Bask in the days of summer with this two-song set featuring some of the biggest hits from 2021.,11/21/2021,2,7:37,28,19,"1818, 1649",https://open.spotify.com/playlist/3mMqnNFYFwJYOrodXhXzUi?si=ee5b75b6410042d9,1445,814,"72, 117",classic,210,,,157
"Monster ""Fortissimo""","Step up to the stand, Maestro! Join Coach Doc and the Supernatural Symphony for the first-ever Classical music Monster, showcasing some of our past and future favorites.",11/22/2021,2,33:25:00,28,24,"2014, 1697, 1698, 650, 1218, 665, 1477",https://open.spotify.com/playlist/2b04SDEDDGndE6Dq5Hg8Cm?si=c85374c6d94f4657,1462,4343,"47, 95, 124, 87, 90, 43, 33",classic,1188,,,1064
Quick Hits Rock Boom Baby,Shake it and shout with Coach Leanne to souled out Rock and Pop from the 1960s in this short-form workout.,11/21/2021,3,7:14,25,23,"1841, 1840",https://open.spotify.com/playlist/2hqIMveBgkGhHspWPhg5o5?si=a0cc8bd021084191,1485,1013,"75, 35",classic,244,,,138
Quick Hits Guilty Pleasures,Relive your Disco dreams with Coach Dwana and this two-song set featuring 70s classics.,11/21/2021,1,9:19,32,23,"1706, 298",https://open.spotify.com/playlist/0bLV3FazZGNfQkvXS6dJFj?si=796da7bdf8654cb0,1453,689,"61, 78",classic,184,,,153
"Pop Till You Drop ""Happier""",Keep your hands up and spirits higher to this current Dance Pop playlist with Coach Leanne in your corner.,11/22/2021,1,13:41,25,19,"1549, 1129, 1131",https://open.spotify.com/playlist/3O213VTAFRRnUEgMrW0BK1?si=d8bb60ec4ce744e7,1219,647,"106, 77, 100",boxing,249,268,,1
"Rapattack ""Flexicution""","They aren't ready for the hook, athlete! Throw some punches with Coach Raneir to Hip Hop and Trap from the 10s.",11/23/2021,2,14:14,27,21,"2002, 1625, 1621",https://open.spotify.com/playlist/3BDUqrtYNgRZIkzzcPQiCi?si=510db006fd144ab0,1467,717,"11, 1, 112",boxing,342,568,,1
"A Call To Arms ""Armed & Anthemic""","Unleash your Bicep Beast with Coach Mark to epic and anthemic broad genre Rock music, set to maps specifically built to target your arms and upper body.",11/23/2021,3,20:37,33,20,"855, 1982, 1983, 1984, 1985, 1986",https://open.spotify.com/playlist/3jnbouM4aNug5I3PVn1qdh?si=f6673b7753a64406,1446,2879,"44, 18, 127, 37, 113, 68",classic,605,,,98
"Y2K Babyyy ""Galvanize""",Don't hold back! Break it to the beat with Coach Leanne to Alternative Electronic favorites from the 90s and 00s.,11/24/2021,3,14:42,25,"19, 20, 22","398, 2013, 2086",https://open.spotify.com/playlist/5qln02XRG77UvPBfR4DHgQ?si=27533a8303e24bca,1471,811,"89, 51, 91",boxing,420,753,,1
"Joy ""Ebb and Flow""",Find your rhythm and flow alongside Coach Raneir to contemporary Pop and R&B music.,11/24/2021,1,23:00,27,19,"857, 829, 352, 350, 1033, 830",https://open.spotify.com/playlist/3Lw2tTo9ZQoQVKlbxKoGEa?si=0db1bfe55a244627,1419,1828,"33, 92, 73, 66, 94, 13",classic,528,,,541
"Gratitude ""Sweet Sounds""","The best attitude is gratitude, athlete. Feel great and full after moving to feel-good, nostalgic Pop and R&B with Coach Dwana.",11/25/2021,2,20:55,32,"19, 23","2024, 2111, 2041, 2025, 2026, 510",https://open.spotify.com/playlist/43zBkwxrCQxBmDcm9lKE2e?si=9e52bec00dd840dd,1448,2197,"62, 2, 59, 118, 50, 65",classic,583,,,479
"Pop Till You Punk ""Light Em Up""","Light Em Up, Coach Mark is on fire with these contemporary Alternative Rock and Pop-Punk anthems from the 00s through today. Stretch your neck and brace yourself for some serious head bangers, athlete!",11/26/2021,3,22:31,33,20,"421, 1943, 366, 1321, 934, 162",https://open.spotify.com/playlist/4hyNDF2PqVv0hruEQ94ELB?si=3ac21f54a13c43cf,1376,3747,"112, 41, 29, 127, 100, 136",classic,865,,,386
"Moment @ Julier Pass, Switzerland","Take a ride through the Julier Pass, one of Switzerland's most scenic roads, located in the Albula Alps. To enjoy this moment without music, hit the menu button on your left controller to adjust the volume. [Experimental]",11/26/2021,4,10:04,31,,1224,,1495,0,80,meditation,,,,0
Quick Hits Molten Rock,Feel the angst with two 00s Alternative Rock tracks perfect for smashing targets to.,11/28/2021,2,8:13,32,20,"1871, 1872",https://open.spotify.com/playlist/6WMzBoyuQWhqv3Rb1j0bEr?si=8127f081ebcc42d4,1473,1012,"79, 104",classic,271,,,228
Quick Hits Hair Brained,Belt out these glammed up 80s Rock hits in a slammin' high intensity two song set!,11/28/2021,3,9:53,32,20,"1665, 1662",https://open.spotify.com/playlist/2mS7e54Hc2fxf3E747g2ts?si=eb0c3216ac904b60,1415,1653,"87, 78",classic,400,,,230
"Stretching ""Boxing Stretch""","Join Coach Leanne for this stretch session designed to hit all of the major muscles used in your Boxing workouts. With both standing and seated stretches, mobilize and loosen the muscles of your hips, trunk, upper back and arms. Use this stretch before or after your workout.",11/27/2021,5,8:57,25,,,,1544,0,,stretch,,,,1
"Self Love ""I Am""","""I am..."". The two most powerful words in any language. Coach Doc empowers you to believe in yourself, recognize and accept all that you are. ""I am,"" allows you to live in your truth and reaffirm all that you are and desire to be.",11/27/2021,2,15:58,28,"19, 23","767, 2044, 1152, 1805, 447",https://open.spotify.com/playlist/3MjSb59I0Z0zQGwl7knjd5?si=fcef87626fd6496f,1492,2214,"18, 97, 44, 94, 115",classic,592,,,498
Quick Hits Mood Booster,Get that mood boosted with two soulful and sunny 70s throwbacks.,11/28/2021,1,11:23,33,"20, 23","1677, 1816",https://open.spotify.com/playlist/5KiktfGpt9wDycAYT2q5Wp?si=0b3bf7ccf4b34b25,1474,939,"59, 73",classic,355,,,558
"Freedom Rock ""Rock Slip n' Roll""","Rock, Slip and Roll your way through this Classic Rock boxing workout. Join Coach Doc as you throw jabs to 70s throwbacks.",11/29/2021,1,12:47,28,20,"1275, 2003, 774",https://open.spotify.com/playlist/4xrLZNxL3CXLmIekP90JsN?si=78dcb46853734c16,1465,744,"46, 125, 103",boxing,280,273,,1
"Super Monster ""Pros Only Party""",Ready for the ultimate challenge? This 45-minute Super Monster is a Pros Only party packed with Pop Dance hits in our highest intensity! Get ready for an array of our fastest and most complex maps for a marathon of movement.,11/29/2021,3,48:29:00,27,19,"1822, 1439, 1124, 2017, 1442, 1187, 566, 2016, 1175, 73, 2018, 1145, 996",https://open.spotify.com/playlist/4e1xGaGEINSJtBjclcyz4j?si=e7a6452e143d423f,1475,8530,"45, 20, 69, 92, 5, 59, 73, 47, 66, 27, 17, 32, 54",classic,2315,,,2029
"Take The Stage ""A Trans-Siberian Orchestra Holiday""","Kick off the holiday season with back stage passes to Trans-Siberian Orchestra's epic rock extravaganza. Take the stage as you wail on guitars, smash on drums, and lead the band in an immersive holiday concert you won't forget!",11/30/2021,2,23:40,25,24,"2078, 2077, 2079, 2080, 2082, 2083",https://open.spotify.com/playlist/10jCNYZI8cmWLFJTQFq8BK?si=f5cc223e97734eea,1515,3544,"90, 100, 127, 28, 77, 38",classic,903,,,646
"Joy ""Beat Of My Drum""",Box to the beat of your drum in this upbeat workout packed with Indie Pop beats.,11/30/2021,2,15:55,33,19,"1340, 1713, 1992",https://open.spotify.com/playlist/2MoXvY2vMuubXaSQn7fMaz?si=226bee4530cc4cfa,1454,864,"76, 101, 52",boxing,362,492,,1
"Shower Songs ""In The Groove""",Get in the groove and sing along to these feel-good Disco Funk classics! Sing it out and boogie on down with Coach Leanne.,12/1/2021,1,21:13,25,"19, 23","653, 1514, 599, 1669, 669, 1573",https://open.spotify.com/playlist/6usZthZDeJslhNn1vXNQAk?si=09c8de06ca3a4a33,1491,1827,"111, 8, 108, 62, 82, 98",classic,548,,,608
"Pop Till You Punk ""Arms Race""",Join the scene with some Pop Punk heavy-hitters. Go toe-to-toe with Coach Mark in this angsty rock match.,12/1/2021,3,14:33,33,20,"1850, 1993, 1994",https://open.spotify.com/playlist/2REgeWhwEuBNIPzouJPND8?si=83956a19f2f14187,1461,1383,"86, 72, 78",boxing,490,375,,1
"Just Dance ""We Came To Party""","Light up that disco ball and hit the dance floor! These upbeat Dance remixes are packed with soulful throwback samples and big, bright bouncy energy.",12/2/2021,2,19:21,32,"19, 22","1827, 1600, 2007, 917, 1712, 2008",https://open.spotify.com/playlist/4Jee7h2enyhkhwBSfJ2mQC?si=e6cb018759a54b4f,1476,2420,"29, 71, 100, 5, 41, 44",classic,689,,,683
"Mood Booster ""Happy Hits""",Soak up the sunny vibes with Coach Leanne. Shine your light to these current upbeat Pop Rock bops.,12/3/2021,3,22:59,25,19,"2048, 2046, 388, 60, 2047, 944",https://open.spotify.com/playlist/6tLDn0AaAdZNLN0p1AKvox?si=4b68de5607c24086,1479,3698,"80, 116, 81, 68, 74, 50",classic,902,,,541
"Moment @ Mittelgipfel, Switzerland","Stand on the icy summit of Mittelgipfel mountain in the Swiss Alps. To enjoy this moment without music, hit the menu button on your left controller to adjust the volume. [Experimental]",12/3/2021,4,10:08,31,,1348,,1428,0,127,meditation,,,,0
"Meditation ""You First""","Your relationship with self is most critical for everything aligning in your life. Make self a priority. You do so much for others but remember, you have the right to put yourself first.",12/4/2021,4,4:43,28,,,,1472,0,,meditation,,,,0
Quick Hits Pop Till You Drop,Feel the beat to Pop classics from the 2010s with Coach Raneir in this short-form workout.,12/5/2021,3,10:14,27,"19, 22","1898, 1900",https://open.spotify.com/playlist/1WA5nqAf3FBbgJCNIgXHIx?si=c2d6dd4e586049ba,1504,1282,"100, 90",classic,335,,,262
Quick Hits Retrofit,Bring on the night with Coach Doc and these killer 80s Pop Rock favorites in this short-form workout.,12/5/2021,2,9:12,28,20,"264, 724",https://open.spotify.com/playlist/7zHCAPPtXbI2UvAKkWdGHi?si=1ef3d4030d054b24,1379,944,"37, 82",classic,294,,,350
"Self Love ""You Are Worth It""",Shine a light on where you came from and where you want to go. Move along to some 80s and 90s throwbacks as we dig deeper with Coach Dwana in this self love journey.,12/4/2021,1,24:19:00,32,"19, 20","2057, 542, 1888, 2058, 2059, 1091",https://open.spotify.com/playlist/0QUMPgFYQKkpaTmVqLrUWH?si=5afb2fc584e64462,1477,1999,"75, 27, 69, 35, 98, 112",classic,587,,,625
Quick Hits The Drop,"Dance along with Coach Leanne to an electric mix of Pop EDM hits in this quick, two song set.",12/5/2021,1,8:21,25,22,"838, 387",https://open.spotify.com/playlist/2HpsbxT54rWsoANkJV6iUJ?si=5dddf3e74c7948b8,1486,588,"115, 41",classic,184,,,220
"Strut ""Legendary""","Rock on with Coach Doc, athlete! Gear up and show us your strut to Classic Rock heavy-hitters from the 1960s.",12/6/2021,2,21:25,28,,"2050, 585, 309, 2052, 425, 2053",https://open.spotify.com/playlist/5RkWmWb2w5U4rngPQkeJQW?si=ab3095310ff6462c,1487,2655,"97, 2, 80, 77, 86, 11",classic,745,,,714
"Game Time ""All Out""",It's time to get down to business with Coach Raneir! Get your gloves on and game face ready to Hip Hop from the early 2000s.,12/6/2021,1,15:09,27,21,"892, 1323, 1923",https://open.spotify.com/playlist/6ShYTGP7Yw9OVYEXM25BTV?si=9bfe5746a70e4507,1488,703,"84, 55, 56",boxing,283,326,,1
"The Drop ""Deep Groove""",Leave it all on the dance floor with Coach Raneir. Show us your moves and feel the Deep Groove to these House and Dance tracks from mid-2010s to today.,12/7/2021,3,23:13,27,22,"621, 2019, 2020, 2022, 2021, 888",https://open.spotify.com/playlist/47LZ3UC2whqVgGDclsU5Ku?si=b76a0f1662754e6d,1489,3300,"79, 26, 3, 53, 61, 35",classic,860,,,667
"Pump, You Up 90s ""Pump It Up""",Y’all ready for this?! Get your head in the game alongside Coach Mark to throwback dance songs from the 90s that are guaranteed to make you move.,12/7/2021,2,15:05,33,"19, 22","493, 1120, 484",https://open.spotify.com/playlist/1s3YzFSqs3sdsv4ln82lCq?si=80e672e2d79a478c,1468,1001,"62, 42, 60",boxing,399,471,,1
"Superfreak ""Move It""","We need the funk, athlete! Boogie on down with Coach Dwana to Disco and Funk favorites from the 1970s.",12/8/2021,1,20:52,32,23,"933, 301, 297, 1863, 2060, 1707",https://open.spotify.com/playlist/7drCAy5yChbfXhPaxdsCHD?si=4531dd8c40914263,1497,1573,"89, 123, 48, 46, 64, 45",classic,460,,,484
"Pop Till You Drop ""Party People""",Slip and strike to sleek Pop from the 00s/10s with Coach Leanne in your corner.,12/8/2021,3,9:17,25,19,"781, 1517",https://open.spotify.com/playlist/0cmVzJvz9rNeF62sP00ZPF?si=cca275dc65084db3,1466,876,"17, 101",boxing,322,287,,1
"Sweaty Flannel ""Grunge Greatness""",Blast back to the 90s Grunge era with Coach Leanne and get fired up with these angst-fueled Alternative Rock hits!,12/9/2021,3,24:01:00,25,20,"362, 758, 1210, 2063, 2061, 2062",https://open.spotify.com/playlist/4M1VE5fCWVnWkaBnNMiTDO?si=970b1ccda5e64688,1498,3895,"105, 136, 63, 6, 117, 86",classic,930,,,505
"Glutacious ""Drop It Low""","Bounce into these body-focused maps with Coach Doc, set to booty-dropping, Rap Pop and Hip Hop hits from the mid-10s and today.",12/10/2021,1,18:18,28,21,"2099, 2100, 418, 1205, 1867, 1510",https://open.spotify.com/playlist/5AwV2BKJlV7krnqORQS6gR?si=90889c1a0dc7462e,1499,1070,"104, 34, 45, 40, 8, 56",classic,362,,,493
"Moment @ Pamukkale, Turkey","Soak in the serene sunset overlooking the white travertine terraces of Pamukkale, Turkey. To enjoy this moment without music, hit the menu button on your left controller to adjust the volume. [Experimental]",12/10/2021,4,10:04,31,,1237,,1550,0,62,meditation,,,,0
Quick Hits Smooth Sailing,Keep it light and breezy with Coach Leanne to smooth Singer-Songwriter Roots Rock from the 70s and 80s in this short-form workout.,12/12/2021,1,9:50,25,20,"1043, 1366",https://open.spotify.com/playlist/7DotCufU9y29vtEocMr9nj?si=b35c5117c704472f,1503,730,"93, 70",classic,201,,,183
"Meditation ""Believe In You""","Before anyone can believe in you, you must believe in yourself. You have all the gifts and talent within you. Commit to trusting yourself and living your life to the fullest.",12/11/2021,4,4:13,28,,,,1501,0,,meditation,,,,0
"Just Dance ""Out With A Bang""",Bring the boxing heat to these 2010s Dance tracks with Jazz and Latin flair alongside Coach Doc.,12/13/2021,1,13:30,28,,"2055, 2054, 1893",https://open.spotify.com/playlist/5Kwh7X2GCm8JTtpLBHJD5b?si=24cb19be67f344d0,1514,843,"59, 118, 95",boxing,330,367,,1
Quick Hits Abs-o’licious,Target your abdominals and obliques with body-focused maps tuned to totally awesome hits from the 80s in this two song set.,12/12/2021,2,11:52,33,20,"604, 276",https://open.spotify.com/playlist/1bamzQtZbr1fnM1h3tJdMM?si=78d8fae2127345fc,1502,948,"13, 113",classic,265,,,251
"Self Love ""Get After It""",We are all capable of so much more than we realize. Get ready to continue your self love journey by tapping into your unlimited potential and showing the world your greatness alongside Coach Mark!,12/11/2021,2,23:30,33,"20, 25","1473, 2084, 1992, 642, 1085, 1418",https://open.spotify.com/playlist/2T0MKw5Xg8XuILmnjvYeAv?si=fdf20d4e221c4186,1500,2637,"99, 116, 124, 125, 107, 108",classic,773,,,818
"Retrofit ""Riding The New Wave""",Send yourself into synth shock with these iconic tracks from the Post-Punk and Alternative Dance scenes. Ride the New Wave back to the 1980s alongside Coach Leanne to these classic hits.,12/13/2021,2,23:50,25,"19, 20","1107, 728, 2103, 2101, 2102, 2104",https://open.spotify.com/playlist/4CeJl86KlbsH5y2vIS4050?si=dd687ce28a5848f6,1505,2947,"58, 110, 117, 54, 20, 47",classic,856,,,888
Quick Hits Just Dance,Bring the attitude to these girl boss Pop hits from 2010s in this short-form workout with Coach Raneir.,12/12/2021,3,8:26,27,19,"1785, 1734",https://open.spotify.com/playlist/440DLcrukjJB1KNGD0e3IC?si=66fab60a46cb4b19,1510,1335,"60, 101",classic,299,,,107
"Monster ""Pop Rocks""",Turn it on and turn it up with Coach Dwana! Harness your power with this energizing and upbeat Pop Rock Monster featuring heavy-hitters from the 2000s to today.,12/15/2021,1,29:11:00,32,"19, 20","2118, 2120, 1792, 185, 1038, 2119, 1040, 1919",https://open.spotify.com/playlist/1tyx7qi4fGUFuS71Nip7af?si=98c6c5f41b6346a2,1507,2326,"2, 70, 44, 93, 75, 127, 80, 9",classic,753,,,959
"Power ""We Are Legends""",Get fired up with Coach Leanne in your corner to game face-inducing Hip Hop from today.,12/14/2021,2,10:18,25,21,"2066, 69, 153",https://open.spotify.com/playlist/327j5yX3IoNlN3XShcG1VY?si=d187979dd0e345ae,1517,862,"11, 3, 79",boxing,296,181,,1
"Hip Hop You Don't Stop ""New Jack Swing""",Running Man dance your way back to the early-90s with Coach Dwana to this four song set featuring Hip Hop and New Jack Swing favorites.,12/14/2021,3,21:03,32,"21, 23","2096, 2076, 1092, 482, 490",https://open.spotify.com/playlist/7MgCP2eYgkORiatkLTRfGB?si=8aff0838ba7b481c,1506,3000,"76, 46, 66, 52, 67",classic,880,,,935
"Rock Hard ""Boom Boom Blast""",Rock the ring with Coach Mark to bangin’ Rock and AltMetal from the 00s and 10s.,12/15/2021,3,14:43,33,20,"1811, 2067, 2087",https://open.spotify.com/playlist/1mHP0zFztETNn9hcAK0ThJ?si=da68e8fcc7874124,1518,1239,"136, 38, 48",boxing,440,346,,1
"Guilty Pleasures ""Tween Dream""","Break out the burned CDs with Coach Raneir and press play, athlete! Indulge in these infectious tween Pop bops from the late 90s and early 00s.",12/16/2021,2,18:07,27,19,"2091, 2093, 1531, 1788, 2094",https://open.spotify.com/playlist/7aBMSNiYVlCOJdkkjL62WX?si=ed8b99639d82479c,1524,1811,"99, 112, 101, 59, 27",classic,458,,,321
"Sweat Symphony ""Swan Lake""","Take your place for Tchaikovsky's 19th century stunner, ""Swan Lake"". Step center stage and swing through the sweeping orchestral movements of one of history's most iconic ballets.",12/20/2021,2,27:49:00,27,24,"2033, 2037, 2036, 2038, 2042, 2043, 2039",https://open.spotify.com/playlist/7KWDPRbmP3frINKJ7EODsJ?si=20416f04f0c8457d,1513,3012,"68, 81, 92, 63, 125, 84, 76",classic,969,,,1222
"Meditation ""Time For Change""","In order to progress and grow in life, change is necessary. Do not resist change, rather embrace the unknown. Leave behind what no longer serves you and step into your journey with excitement.",12/18/2021,4,5:04,28,,,,1509,0,,meditation,,,,0
"Quick Hits Pump, You Up 90s","Don't change that dial, athlete! Tune in to these 90s Adult Rock ear-worms with Coach Mark in this quick, two song set.",12/19/2021,2,10:27,33,"19, 20","1658, 1657",https://open.spotify.com/playlist/0RM9EMqOW3I82uKFm6skqe?si=0298160b08204af3,1511,1351,"106, 87",classic,366,,,319
"Y2K Babyyy ""Let's Go DJ""","Turn it up, DJ! Ignite the dance floor with Coach Doc and Pop-forward Rap and Hip Hop party hits as we blast back to the 2000s.",12/17/2021,3,21:40,28,21,"2108, 2109, 2110, 1338, 1140, 869",https://open.spotify.com/playlist/083rISNhAFbvlSIfoNGZRJ?si=b369ef3b5c9043fe,1508,3354,"55, 98, 111, 58, 138, 56",classic,852,,,604
"Moment @ Loch Grannoch, Scotland","Set sights on the Scots Pine and Douglas Firs at serene Loch Grannoch in the Scottish Highlands. To enjoy this moment without music, hit the menu button on your left controller to adjust the volume. [Experimental]",12/17/2021,4,10:04,31,,1302,,1562,0,124,meditation,,,,0
Quick Hits Power,Power through these high intensity Pop Rock songs from the late 2010s with Coach Mark in this two song set.,12/19/2021,3,9:25,33,20,"1651, 1783",https://open.spotify.com/playlist/33crfiueWCPi1SPTfmjj7t?si=73e0aa67c08a4d43&nd=1,1470,1225,"68, 107",classic,364,,,395
Quick Hits Hip Hop You Don't Stop,Join Coach Raneir for light and fun Hip Hop hits from the 80s and 90s in this short-form workout.,12/19/2021,1,11:04,27,21,"571, 279",https://open.spotify.com/playlist/3tkFFdMIxKOBHXbJ6MAle1?si=8c52400e29654e53,1512,779,"28, 17",classic,257,,,337
"Power ""Bring The Thunder""",Take the ring by storm and strike through these hard-hitting contemporary Pop Rock tracks with Coach Leanne in your corner.,12/20/2021,1,12:13,25,"19, 20","1652, 2116, 2115",https://open.spotify.com/playlist/7c2xHwHQYLSUm4G4tXfaqx?si=7caef946404c4138,1532,481,"38, 87, 41",boxing,231,418,,1
"Self Love ""Confidence Kick""",Come as you are and celebrate your strength with Coach Leanne. This self love dance party will have you grooving and smiling as you embrace your power and strength.,12/18/2021,1,19:56,25,"22, 104","1261, 1389, 2075, 2085, 1186, 391",https://open.spotify.com/playlist/3XcUXBlXtAsvRYsy1H867f?si=faf3b41d1fa547a1,1451,1783,"47, 16, 5, 73, 18, 54",classic,755,,,1328
"Molten Rock ""Blues and Roots""",Get your kicks to a set featuring choice Modern Blues Rock. Whomp on those targets and stomp along to the beat with Coach Mark.,12/21/2021,3,20:06,33,20,"1410, 2132, 1984, 2133, 1161, 339",https://open.spotify.com/playlist/4oWIg1bWXBxnw0AEgHSswZ?si=1bf18ef232c04e9c,1522,2894,"103, 105, 6, 138, 82, 136",classic,688,,,364
