Name,Description,Date,IntensityId,Length,CoachId,GenreIdList,SongIdList,SpotifyLink,WorkoutId,MaxTargets,LocationIdList,WorkoutType,MaxScore,MaxDodges,MaxKneeStrikes,MaxTriangles
"The Drop ""Don’t Close Your Eyes""","Hands in the air with Coach Dwana! Nonstop euphoric big-room, peak-house here, all of it steeped in heart-swelling melody and emotional catharsis.",5/3/2022,3,20:22,32,22,"2541, 404, 2542, 287, 1385",https://open.spotify.com/playlist/0gvdZkGC12J23edoORPldN,1923,3045,"47, 71, 115, 68, 18",classic,816,,,692
"Moment @ Rongbuk Glacier, Tibet","Sit silently in the shadow of Everest at Rongbuk Glacier in southern Tibet. To enjoy this moment without music, hit the menu button on your left controller to adjust the volume. [Experimental]",5/6/2022,4,10:13,31,,1184,,1962,0,46,meditation,,,,0
"Super Monster ""(Hair) Metal Marathon""","Travel through the eras of Glam, Metal, and Hard Rock with Coach Mark in this dramatic and muscular workout that's equal parts classic torch songs and music-discovery moments.",5/5/2022,1,52:10:00,33,20,"2614, 999, 1566, 607, 2005, 2618, 2617, 981, 1565, 896, 2619, 2616",https://open.spotify.com/playlist/4wCkusn0D2tOK8adcmUeUQ,1950,4311,"11, 116, 78, 16, 13, 123, 92, 105, 65, 90, 110, 146",classic,1427,,,1885
"Guilty Pleasures ""If It Feels Good, Do It""","Coach Doc wants to you to ""bang on the drum all day"" with this fun, carefree bout of late-70s and early-80s Pop that's a little bit Rock, a little New Wave, and just the right amount of goofy.",5/3/2022,1,11:15,28,"19, 20","2562, 2563, 2565",https://open.spotify.com/playlist/2RcahyGpbA215rOmqxuU7P,1940,644,"108, 73, 87",boxing,256,314,,1
A Call To Arms “En Fuego!”,"Get fired up with Coach Raneir to an eclectic playlist of Latin-laced EDM, Pop and Reggaeton music. Shake your hips while working your upper body to maps created specifically with fast and complicado patterns to light up your arms and shoulders.",5/6/2022,2,20:29,27,"19, 21, 22, 104","2534, 1892, 2535, 2536, 2085",https://open.spotify.com/playlist/5LqSrfHrJxaAuykd4ZiZnE?si=c017750fa5304088,1938,2731,"8, 104, 89, 82, 54",classic,548,,,6
"Abs-o’licious ""Ab Agility""","Don't put the red light on moving your body, athlete! Blast back to the 80s with Coach Raneir and tune into your core with maps designed specifically to target your abdominals and obliques.",5/6/2022,3,13:38,27,"19, 20","2581, 2579, 2580",https://open.spotify.com/playlist/1eVwaRmFM6eoR9PqITcUNa?si=e21758d4264c4c52,1945,926,"50, 72, 60",boxing,426,731,,1
"Meditation ""Go Within""","We are asked to be strong in every moment of our day. We look for ways to show that strength to others through our actions and ability to persevere.  Yet, at times, we are left feeling weak, disguising our pain from the world. It is time to go within. Your true strength lies within you.",5/7/2022,4,13:37,28,,,,1971,0,,meditation,,,,0
"Pump, You Up 90s ""Club NYC""","Coach Ranier is taking you ""deep inside"" an NYC nightclub for a turned-up and  90s House and big-room Electronic set. Are you down?",5/9/2022,1,20:41,27,22,"2471, 2472, 1489, 2458, 484",https://open.spotify.com/playlist/0GNiuoyLwo3oFJJZgiKyrx,1871,1390,"105, 74, 92, 47, 27",classic,532,,,848
"Monster ""We Will Be Victorious""",Muster up the strength and courage alongside Coach Mark for our debut Boxing Monster in this all-out Modern Rock mash.,5/9/2022,2,29:39:00,33,20,"2659, 1982, 2804, 2658, 2311, 1985, 2660",https://open.spotify.com/playlist/7xV67YqFBYbWDVN5ZQX0IM?si=0979d2fcddfb46d8,1989,1959,"100, 13, 44, 79, 91, 51, 52",boxing,826,1111,,1
Quick Hits Y2K Babyyy,Turn up the dial for these 2000-era rock favorites while Coach Mark leads you through a quick Boxing workout.,5/8/2022,3,10:00,33,20,"1715, 205",https://open.spotify.com/playlist/71mIY7D1I8Gon6op1AIEde?si=ead26abe0ef54028,1948,804,"127, 53",boxing,289,243,,1
"Strut ""Kick It""","Cue the horn section, athlete! Swagger through feel-good Hip Hop, R&B and blues-influenced Rock with Coach Doc.",5/7/2022,2,12:08,28,"20, 21, 23","2532, 2531, 2533",https://open.spotify.com/playlist/4YSi0QyUpNyUMN8HOgo0Yf?si=cabce00f83e04f0f,1939,814,"27, 2, 116",boxing,335,458,,1
Quick Hits Rap-ture,"You know that Coach Doc isn't going home, which means you're going hard in this Quick Hit Rap-ture workout.",5/8/2022,1,8:47,28,21,"2097, 870",https://open.spotify.com/playlist/5EIgoVRVG8w7pPdIESFMQB?si=a45baec5009a48df,1949,416,"6, 72",boxing,189,253,,1
Quick Hits Retrofit,Coach Mark keeps you hanging on for a Quick Hit 80s party in this boxing Retrofit.,5/8/2022,2,10:13,33,"19, 22","2205, 974",https://open.spotify.com/playlist/3fCEtDPgEELRRSDS8xWbFW?si=0a45dea1ace6444a,1947,663,"64, 5",boxing,277,373,,1
"Hoedown Throwdown ""Lasso Up!""",It's getting rough and rowdy in this roadhouse filled with some of the best Country of the early 2000s. Coach Dwana's keeping it bright and fresh—and twangy and swinging.,5/7/2022,3,22:04,32,25,"2561, 2559, 2560, 1470, 2213, 1471",https://open.spotify.com/playlist/6Pub8HfW3RNz1FdKiD1XLc,1943,3351,"80, 81, 105, 107, 138, 48",classic,827,,,524
"Rap-ture ""Pull Up!""",Somebody come get Coach Doc—he's feeling that beat with this short 'n' sweet contemporary Hip-hop Boxing bout.,5/11/2022,3,12:55,28,21,"2547, 2546, 2548",https://open.spotify.com/playlist/1lA11MTuCQZGPqZCmDNRlw,1941,1161,"20, 59, 54",boxing,461,537,,1
"Just Dance ""Carefree""","Bring the Funk to these Dance, Pop, and Hip Hop tracks with Coach Raneir!",5/11/2022,2,17:09,27,"19, 22, 23","2652, 2647, 2649, 2650, 2648",https://open.spotify.com/playlist/7sHi10xxvHKouScI3XWfKt?si=7148361de2fa4de9,1973,1730,"45, 124, 27, 77, 62",classic,550,,,681
"Molten Rock ""Ready for Everything""",It's back to the Garage Rock revival of the mid-2000s with this fully-loaded match-up in the ring with Coach Mark.,5/10/2022,1,13:57,33,20,"641, 2610, 338",https://open.spotify.com/playlist/4BMEx8gzzso0K6clxZoyJF,1956,706,"8, 98, 71",boxing,282,351,,1
"Nouveau Disco ""Do What You Do""","It's time to get down to the Disco sound, athlete! Dance to LoFi Funky House mixed with some Disco-inspired Pop gems - guaranteed to make you sweat!",5/10/2022,3,22:58,27,"19, 22","942, 2582, 1589, 1978, 2362, 2583",https://open.spotify.com/playlist/45TFlL3mTYMbF66wjS1RVy?si=aac8f7d3344046c8,1957,3019,"28, 140, 112, 41, 101, 139",classic,775,,,572
"Prom Night ""Flower Power""","Travel back in time with Coach Chesney to prom night from the late 60s. Do this workout before heading out to pick up your sweetheart, just don't forget the corsage or boutonniere!",5/12/2022,1,19:54,34,"19, 23","256, 2168, 2283, 326, 1299, 2257",https://open.spotify.com/playlist/40w8Czaejj23mi3lLW0dHV,1946,1614,"143, 74, 118, 141, 70, 33",classic,523,,,668
"Moment @  Clear Lake, Oregon","Clear your mind in the Pacific Northwest by the tranquil waters of Clear Lake, Oregon. To enjoy this moment without music, hit the menu button on your left controller to adjust the volume. [Experimental]",5/13/2022,4,10:08,31,,1348,,1969,0,81,meditation,,,,0
"The Drop ""Get Ur Brain In The Game""",Push it to the limit with Coach Leanne in this supercharged boxing workout that is sure to rev your engines.,5/13/2022,1,11:23,25,22,"1249, 2141, 2449",https://open.spotify.com/playlist/6JbKCLWa8mpJQapzT7Seae?si=83b29d7078b649c8,1958,426,"136, 40, 11",boxing,217,411,,1
"Meditation ""I Am Here""","Take a moment to tap into your power and fully embrace the now with Guest Meditation Coach, Andrea Ming. Experience a deeper state of relaxation while improving your concentration and mindful awareness for a renewed sense of calm. This is your time to simply Be, Athlete.",5/14/2022,4,8:53,38,,,,2017,0,,meditation,,,,0
"Y2K Babyyy ""Would You Do It?""","You'll be singing ""yeah, yeah, yeah!"" and ""more, more, more!"" along with Coach Mark throughout this selection of mid-2000s Rock songs that are all rainbow-bright melodies and sugar-sweet lyrics.",5/14/2022,3,13:56,33,"19, 20","2668, 1852, 2117",https://open.spotify.com/playlist/7CdghhhTsKmOCf9ODUpylu,1972,1077,"113, 75, 97",boxing,426,441,,1
"Retrofit ""Tempting (retro)Fate""","It's 80s night at Coach Mark's, and he's pulling out all the stops! Swing along with him on this journey through Gothy Post-Punk that's heavy on the eyeliner and teased hair, jumpy and funky Electro Pop, and cerebral Alternative guitar Funk.",5/13/2022,3,22:04,33,"19, 20","2103, 2591, 2592, 2146, 2593",https://open.spotify.com/playlist/6UlRsUNReQ7qlVhGNnrZAV?si=6b756d5b3d2842bf,1959,3585,"35, 99, 18, 100, 32",classic,901,,,615
"Pop Till You Drop ""Good4U4Sure""",Box to the top of the charts alongside Coach Dwana and these current Pop hits by artists from the AAPI community as we continue to celebrate Asian American and Pacific Islander Heritage Month.,5/12/2022,2,11:53,32,19,"2635, 1465, 1819",https://open.spotify.com/playlist/5FICC3MhbRkHKFyPFgAILt?si=a34fb8ac1bdc4dd0,1982,823,"68, 87, 37",boxing,337,396,,1
"Reggae Getaway ""Putting On A Vibe""",Lay back and lean into your weekend vibe as Coach Doc leads you through this dialed in Reggae Getaway.,5/14/2022,2,22:36,28,104,"1598, 567, 2595, 2594, 1750",https://open.spotify.com/playlist/7FkkdTJ2LWyQ4tJIpz9Bb8,1976,2634,"73, 59, 64, 48, 65",classic,726,,,664
"Girl Power ""Global Galz""","Bop around the world alongside Coach Dwana to these international female Hip Hop and Pop powerhouses. Please note, some spicy lyrics in this workout are not for the faint of heart!",5/16/2022,1,9:53,32,"19, 21","2149, 2626, 2381",https://open.spotify.com/playlist/2GF51ovt67r8GQCxpIowE3?si=12139c8694804578,1981,410,"79, 108, 67",boxing,176,204,,1
"Sweat Symphony ""Movement Masterpiece""","You and Coach Dwana are taking the symphony on the road, touring through Japan and China for this special Classical course that will warm your soul and lift you into the clouds.",5/16/2022,2,18:59,32,24,"2662, 2663, 2664, 2665",https://open.spotify.com/playlist/4nSYYHyV753lyA1nCuW73O?si=5405469998cf4bcb,1980,1685,"94, 17, 70, 6",classic,622,,,950
"Pros Only ""Welcome to the Madhouse""",Dive into the belly of the beast with this maelstrom of Metal that will make you feel tectonic shifts below and thunder and lightning above. Coach Mark came here to shred.,5/17/2022,3,26:48:00,33,20,"2599, 1630, 1268, 2600, 2601",https://open.spotify.com/playlist/6DGaa7VPIhILy0tze51XCp?si=fbe1f526bfe741f7,1983,5744,"11, 72, 46, 51, 104",classic,1411,,,876
"Pop Till You Punk ""All Hits No Misses""",Fire a fistful of fiesty in the ring with Coach Leanne and these early noughties hotties.,5/17/2022,2,12:54,25,"19, 20","2578, 1379, 2260",https://open.spotify.com/playlist/4teoiCAKcRhnwC29yZ2R9c?si=a40c497add014322,1953,910,"124, 33, 127",boxing,370,480,,1
"Hip Hop You Don't Stop ""Shut 'em Down""",Coach Doc is juking with you to a distinctly powerful and fierce pocket of late-90s and early-2000s Hip Hop that will get you lit up on your light feet.,5/20/2022,2,12:57,28,21,"2588, 1897, 2590",https://open.spotify.com/playlist/2cIJjt3H3OIUsRWZcPsNu2,1951,860,"84, 35, 55",boxing,343,399,,1
"Moment @ Monument Valley, Arizona","Contemplate the passage of time while gazing upon the towering sandstone buttes of Monument Valley. To enjoy this moment without music, hit the menu button on your left controller to adjust the volume. [Experimental]",5/20/2022,4,10:04,31,,775,,2016,0,138,meditation,,,,0
"Power ""We're All Human""","Coach Leanne's here to pull you through it with a bundle of soaring, life-affirming Rock ballads from the UK, Vegas, and Toronto.",5/20/2022,3,22:15,25,20,"2606, 2607, 2608, 2609, 2119",https://open.spotify.com/playlist/3xzeEwHVRl5fzxYLp53Jny,1988,3028,"95, 28, 140, 35, 78",classic,793,,,627
"Guilty Pleasures ""Spice Up Your Swing""",Mi-mi-mi-mi-mi! Warm up those vocals and freshen up your moves as you bring back the band with Coach Raneir. Move along to 90s and early-00s bubblegum boy and girl band bangers!,5/19/2022,2,19:14,27,"19, 20","2646, 2641, 1531, 2643, 2092",https://open.spotify.com/playlist/3DrAcA5lqqc6e0nWcu9F2g?si=2226a5d3b21349d8,1986,1871,"59, 112, 101, 47, 92",classic,553,,,599
"Rapattack ""Hard In Da Feint""",Coach Doc is throwing down with this peak-hour party time match that's gonna make you feel like this boxing ring is a mosh pit.,5/18/2022,3,15:09,28,21,"882, 2603, 2602",https://open.spotify.com/playlist/57fZKEnVjjt9kGd9uHrmiq,1984,1338,"53, 98, 103",boxing,545,674,,1
"Mood Booster ""Pep In Your Step""","Coach Mark's bringing the summertime sunshine with this trio of genre- and mood-hopping tracks that zigzag across laid-back 90s Lounge Pop, 2000s Radio Rock remixed, and late-90s Big Beat. A fancy flight of flavors to keep you floating like a butterfly.",5/19/2022,1,14:56,33,22,"398, 1416, 2505",https://open.spotify.com/playlist/6OXeys5wf6XiqI1R3Pjp6r?si=f3323ce2ff7b4c3b,1987,753,"60, 69, 62",boxing,307,381,,1
Quick Hits Just Dance,Dance around your living room with Coach Dwana to this fun pop playlist with high highs and global vibes.,5/22/2022,3,10:07,32,"22, 104","2348, 2382",https://open.spotify.com/playlist/2BoMm4HYwQ1kZPcGFUubMO?si=923c2a568a3e4b73,1994,842,"67, 45",boxing,342,419,,1
"Fuego ""Danger!""",Coach Doc keeps this Fuego burning bright and keeps you on your toes from start to finish.,5/21/2022,3,11:21,28,104,"2584, 2585, 2586",https://open.spotify.com/playlist/1LEtTKTUWkE8w1R7yoOQNA,1975,1044,"66, 38, 16",boxing,389,353,,1
"Fresh Finds ""Fresh Flow 2.0""",Discover new and exciting sounds fresh from the AAPI community. Join Coach Raneir as we continue celebrating Asian American and Pacific Islander Heritage Month.,5/23/2022,2,21:06,27,"19, 22","2636, 756, 2637, 2638, 2639",https://open.spotify.com/playlist/7cQnDXp7QOS2xZnFJ6Czuo?si=5300a11c929c4c5b,1995,2181,"17, 91, 62, 80, 27",classic,693,,,857
Quick Hits Freedom Rock,Tune up your air guitars as Coach Doc leads you through a classic Freedom Rock pairing in this Quick Hit workout.,5/22/2022,1,7:45,28,20,"774, 1679",https://open.spotify.com/playlist/2FH65iXrbDgPuLDOGZxP1K?si=6ab2a224429d4d26,1917,413,"89, 111",boxing,159,183,,1
"Broken Dreams Team ""Dream It Like You Mean It""",Relive your late-90s Pop-Punk and Pop-Rock lovelorn mixtape—or get into that headspace if it's not your personal experience—with this sweetie pie from Coach Mark.,5/21/2022,1,21:32,33,"19, 20","2621, 2622, 584, 1944, 1380, 1066",https://open.spotify.com/playlist/02Exl8ZaBpVSwIVw8hhP01,1991,1656,"37, 87, 143, 13, 18, 100",classic,516,,,619
"Meditation ""Be Like A Mountain""","Master the art of being steady and serene, just like a mountain, with Guest Meditation Coach, Gullu Singh. Tap into a more grounded presence and find your inner peace while gazing at a beautiful, majestic mountain.",5/21/2022,4,7:46,37,,,,2043,0,,meditation,,,,0
"Freedom Rock ""Reelin' in the Groove""",Pack your bags for a road trip back to the 1970s with Coach Dwana and these Classic Roots Rock favorites.,5/18/2022,1,25:10:00,32,20,"1024, 322, 2604, 634, 1677, 1041",https://open.spotify.com/playlist/7gEFrv73VXTrFve0HDfPyj?si=78201c3e1c4e4a09,1985,1906,"44, 32, 29, 80, 50, 143",classic,627,,,822
Quick Hits Strut,Coach Mark comes correct with this short-form workout of Rock bangers from the first half of the 2000s.,5/15/2022,3,8:09,33,20,"2199, 1231",https://open.spotify.com/playlist/6hDDGL2YisLHYdb0GfRWz5?si=b67155bbf3404a3b,1977,1367,"2, 136",classic,343,,,235
Quick Hits Break Stuff,Find your release with Coach Mark in this aggressive and hard rocking Quick Hit workout.,5/22/2022,2,11:20,33,20,"517, 1996",https://open.spotify.com/playlist/4uv5aMTtKO6CkG5KR9H7Fe?si=addb01231be44dac,1993,784,"20, 6",boxing,306,339,,1
"Hair Brained ""Mood For Metal""","Rock it out in the ring with Coach Dwana! Gear up for guitar and in-your-face, pummel-you-to-the-floor drums in this total shredder.",5/23/2022,1,14:29,32,20,"323, 1664, 2113",https://open.spotify.com/playlist/6tF98PbJCzKOBHRbFigeLm?si=48899f8aed2d4f99,1944,782,"146, 65, 64",boxing,326,453,,1
"Shower Songs ""Love Sings""","Coach Raneir has a bundle of sing-along classics from the 80s and 90s that will make you swoon as you sweat. A bundle of charmed and charming Rock and Pop, a little gothy at times, a little country at others, that will fill your heart as you work it out.",5/24/2022,3,24:00:00,27,"19, 20","1214, 1607, 862, 1608, 2640",https://open.spotify.com/playlist/5Rl7eRWkz3IGNhf1X7d5Tz,2010,3406,"142, 50, 123, 73, 81",classic,984,,,1012
"Nonstop K-Pop ""K-Pop Hwaiting!""",Fire up your fanchant for this all-out K-Pop knockout. Join Coach Raneir for our debut workout of Nonstop K-Pop in Boxing!,5/24/2022,2,19:57,27,"19, 104","2557, 2555, 2556, 1389, 2554",https://open.spotify.com/playlist/7l1ejnQeBlBNEVcpniSThL?si=f3863c85de2541ab,1937,1369,"59, 117, 11, 90, 8",boxing,550,633,,1
"Rap-ture ""Get Low and Explode""",Keep your head up and stay strong with Coach Leanne in your corner. Put in the work to these viral Hip Hop hits.,5/26/2022,1,12:14,25,"19, 21","1132, 1998, 1795",https://open.spotify.com/playlist/3nqestUspfQPwPFPzZ73WN?si=fadf80625bd743bc,2009,581,"43, 110, 48",boxing,278,508,,1
"Glutacious ""Booty Business""","Coach Raneir has a bag of Dance tracks that wanna go Pop and some Pop songs that are here to Dance, and he's serving it up with a side of spicy salsa.",5/26/2022,2,21:47,27,"19, 22","2675, 2676, 2677, 2431, 2678",https://open.spotify.com/playlist/5PydoYRXbQaFGwbC1Yy5mV,2008,2185,"101, 67, 64, 108, 82",classic,765,,,1094
"The Drop ""Remix City""",Strap in for a wild ride with Coach Leanne as she boxes back to the mid-2000s for a round of distorted and dirty club remixes of big Pop hits.,5/25/2022,3,17:05,25,22,"2623, 2624, 2625",https://open.spotify.com/playlist/72e0J8W16dgwgDMBPFkknB,1999,1494,"69, 25, 60",boxing,625,819,,1
"Strut ""Worry Free Me""","Coach Dwana's telling you there's ""nothing to worry about""— just shimmy and shake to these sincere and sweet Indie Pop gems.",5/25/2022,1,18:34,32,"19, 20","2318, 2068, 2674, 2672, 1584",https://open.spotify.com/playlist/6QX6opyMHBcOaBX6HrE0QG,2007,1379,"97, 2, 5, 59, 66",classic,490,,,716
"Meditation ""Paradise Is The Present""","Let go of the day-to-day stress, block out the noise, and tune into your inner you with the help of Guest Meditation Coach, Cassandra Lam. Discover your paradise within as you journey towards peace and serenity.",5/28/2022,4,11:57,36,,,,2021,0,,meditation,,,,0
"Game Time ""Sock-'em Jams""","Coach Mark is coming in hot with some classic jock jams because it's game time and we could all use more hype getting us psyched, right?",5/28/2022,3,21:35,33,20,"2669, 324, 2670, 2671",https://open.spotify.com/playlist/2riJi9jhkxYOkoAGEMx7gK,2012,1718,"138, 51, 91, 17",boxing,700,837,,1
"Y2K Babyyy ""Rock With Me""",Get ready to groove with Coach Doc to Pop and Hip Hop from the early-00s Total Request Live hey days. Some spicy lyrics in this workout are not for the faint of heart!,5/28/2022,1,23:26,28,"19, 21","2682, 1139, 2679, 2308, 1119, 1644",https://open.spotify.com/playlist/3KyfaJFETlJInLKfLP5jw1?si=88effaa5fbec41e1,2020,2094,"69, 20, 45, 56, 112, 93",classic,584,,,552
"That Feeling ""Work Hard""","Join Coach Mark on this 80s Synth-Pop mixers—some lovestruck electronic dance ballads, some jangly Alternative rock, and all full of New Wave sparkle.",5/27/2022,3,18:55,33,"19, 20, 22","1215, 2627, 2628, 1911, 1233",https://open.spotify.com/playlist/0tKxqQsWQeCsGwuBjB7pHx,1998,2393,"136, 37, 116, 95, 38",classic,687,,,695
"Moment @ Mount Ruapehu, New Zealand","Watch the setting sun dip below the horizon from your vantage point on top of Mount Ruapehu in New Zealand. To enjoy this moment without music, hit the menu button on your left controller to adjust the volume. [Experimental]",5/27/2022,4,10:04,31,,469,,2040,0,146,meditation,,,,0
"Pump, You Up 90s ""Keep It Real, World""","Tune in to this nostalgic Pop Rock list from the 90s. It's the right time to roll with the punches alongside Coach Doc, athlete!",5/27/2022,2,15:57,28,"19, 20","1657, 710, 1659, 2666",https://open.spotify.com/playlist/3QIugIcPR9YAkVlw6tVvIS?si=fe2a00c1d20444d3,2011,1126,"86, 124, 94, 118",boxing,470,636,,1
Quick Hits Pop Till You Punk,Coach Doc's got a one-two punch Quick Hit of mid-2000s Emo and Pop-Punk that'll have you feeling all the feels as you sweat it out.,5/15/2022,1,7:54,28,20,"1378, 366",https://open.spotify.com/playlist/5PXJ0H6f0ZPv5gQ0EdHWQg?si=7564436d7dca440c,1978,696,"142, 117",classic,177,,,129
Quick Hits Superfreak,A dash of Disco with this duo from Coach Dwana!,5/15/2022,2,12:06,32,23,"473, 1573",https://open.spotify.com/playlist/07As3501WFaU9hKpINj2cw?si=3e94be92d801486e,1979,1443,"77, 123",classic,424,,,454
Quick Hits Freedom Rock,Feel that old time Rock 'n' Roll with Coach Doc in this short-form throwback workout!,5/29/2022,3,9:06,28,20,"2371, 1677",https://open.spotify.com/playlist/5VGBZ0O9iVUgYtaS5Ix0M6?si=c37e3fe1c2fe4b3e,2022,1461,"46, 66",classic,375,,,277
Quick Hits Take The Stage,"Part the clouds and let the sunshine in with these two dreamy, idylic 60s classics that toe the line between Jazz and Rock and Soul with Coach Mark.",5/29/2022,2,12:32,33,20,"1675, 2012",https://open.spotify.com/playlist/1d5GXnrR9yM13YdthYUe9D?si=4a2616c9bc404c95,2024,1275,"99, 70",classic,397,,,475
"Just Dance ""Dream Team""","Step into a sun-dazzled daydream in the ring, athlete. Breeze through this synth-y Indie Pop set alongside Coach Leanne.",5/30/2022,1,13:34,25,,"2700, 2441, 2442",https://open.spotify.com/playlist/4NNuLBUrlr9Je5WGrOadHl?si=d25a7ee0a99a4921,2026,604,"33, 143, 97",boxing,293,553,,1
"Rock Boom Baby ""Music In The Mojo""","Coach Dwana is gonna shimmy and shake and shuffle and sway her way through a tight collection of roots rock and roll here. Let's go back to basics for this bout, return to our roots for this rocker.",5/31/2022,2,12:53,32,"19, 20","2629, 2631, 1409, 2645",https://open.spotify.com/playlist/5QQ0ngsnqeN85dzqK7nfrJ,2027,1006,"99, 74, 106, 16",boxing,358,278,,1
Quick Hits Mood Booster,Boost your mood through the roof as Coach Mark takes you down memory lane in this charming Quick Hit.,5/29/2022,1,9:31,33,23,"2283, 1548",https://open.spotify.com/playlist/4jEPDf2cNZHcQ7expbtOMk?si=8acdc84aa20d4ddb,2023,631,"8, 118",classic,185,,,196
"Rock Hard ""Box it Out""",Get shredding with this pipping-hot Hard Rock slugger with Coach Mark!,6/1/2022,3,14:40,33,20,"2735, 2736, 2737",https://open.spotify.com/playlist/0ZX8WhoiIRRyWRbrtNEcVp,2047,1531,"127, 142, 29",boxing,552,430,,1
"Monster ""Get in Motion""",Coach Doc wants you to show him what you've got on the court—or on the pitch or on the field or in the arena—and soundtrack it all with these 90s throwback game time Dance and Hip Hop jams.,5/31/2022,3,39:19:00,28,"21, 22","2096, 493, 482, 1789, 1120, 2683, 490, 485, 293",https://open.spotify.com/playlist/2GecXzyZlkJBdzeVsUlHm4,2028,6785,"104, 1, 11, 26, 25, 54, 42, 40, 113",classic,1628,,,906
"Break Up Shape Up ""Something Old, Something New""","Something borrowed, now it's time to get you through those blues! Time hop with Coach Dwana to music with Soul and Motown vibes from past to present.",5/30/2022,2,18:21,32,"19, 22, 23","1840, 2692, 511, 2691, 2690",https://open.spotify.com/playlist/04ddWu9xvcrSax4GC3syqs?si=d94d03f41b9a4365,2025,2025,"140, 41, 62, 28, 139",classic,607,,,675
"Power ""Look Up to The Skies""",Feel strong and empowered in your spirit alongside Coach Leanne. Move with Pride to a powerful Rock and Pop setlist from LGBTQIA+ artists and allies as we kick off our Pride celebration month!,6/1/2022,2,27:17:00,25,20,"2761, 2763, 2453, 2758, 2762, 2757",https://open.spotify.com/playlist/6A4GA3yDs0zkk3fCAWXkv9?si=435c80fa8ee546a0,2045,2966,"62, 90, 141, 68, 2, 146",classic,847,,,846
"Moment @ Col Du Lautaret, France","Inhale deeply the crisp, refreshing air of Col du Lautaret, a quiet and bright mountain pass in the French Alps that rests between Turin and Lyon. To enjoy this moment without music, hit the menu button on your left controller to adjust the volume. [Experimental]",6/3/2022,4,10:04,31,,74,,2123,0,50,meditation,,,,0
"Retrofit ""Catch That Beat!""","Coach Dwana's got some 80s treats for you with this one, a bundle of zippy, quick-witted New Wave Pop tracks that shuffle and swing around like a strobe on a disco ball.",6/2/2022,1,18:08,32,19,"1797, 315, 1889, 2687, 2139",https://open.spotify.com/playlist/2rARBUEpBnbgNmuvR2ZoEx,2035,1367,"108, 20, 69, 107, 37",classic,393,,,401
"Break Stuff ""Inertia""","Dancing at a Punk show in the 70s and 80s was a workout, and Coach Mark is formally making it one with this collection of early English and American acts' high-energy, gritty songs.",6/2/2022,2,16:20,33,20,"2688, 2689, 2194, 518",https://open.spotify.com/playlist/5qwJNUlT9bOMJeBK71rFiE,2034,1110,"58, 48, 55, 53",boxing,478,695,,1
"Jazz It Up ""Big Beat Bop""",Jump in with Coach Raneir to these Jazzy-centric Dance remixes from the 60s through today.,6/3/2022,3,20:24,27,"22, 23","2703, 2701, 2373, 2702, 2347",https://open.spotify.com/playlist/6oGuwAounNS3kO4r3BvvKh?si=d957d82f0e0c4ed4,2033,3035,"56, 84, 106, 87, 79",classic,857,,,834
"A Call To Arms ""Soft and Springy""",Coach Leanne has some sunny and perky Pop tracks to get you bouncing along to the beat. Box along to maps specifically designed to target your arms and shoulders.,6/3/2022,1,16:13,25,"19, 22","2708, 2710, 2711, 1126",https://open.spotify.com/playlist/6CQMoWL0as1zUKf4nlWJj1,2032,1155,"93, 47, 89, 111",boxing,363,0,,1
Quick Hits Hip Hop You Don't Stop,Coach Doc is jumpin' jumpin' in the club like it's Y2K all over again with these Hip Hop crowd pleasers.,6/5/2022,3,7:48,28,21,"2430, 346",https://open.spotify.com/playlist/232I3QpDgBLZzP3BIgoFEU?si=85228e387b6a47c3,2037,700,"56, 61",boxing,245,171,,1
