Name,Description,Date,IntensityId,Length,CoachId,GenreIdList,SongIdList,SpotifyLink,WorkoutId,MaxTargets,LocationIdList,WorkoutType,MaxScore,MaxDodges,MaxKneeStrikes,MaxTriangles
"Rock Hard ""Drive You Wild""",Get ready to shred in this energetic Hard Rock throwback. Rock out to your favorite classics as you go wild with Coach Mark.,3/23/2021,3,23:49,33,20,"984, 1265, 1266, 1267, 1268, 885",https://open.spotify.com/playlist/3yZ26aBpnCnISrP2etkuL1?si=AtszBc0hTSyylQWm53SbYQ&nd=1,898,4137,"20, 41, 6, 34, 79, 54",classic,1013,,,618
"Guilty Pleasures ""Hooked On A Feeling""",Step into the sunshine! This awesome mix of 70s throwbacks is the perfect mood boost. You just can't help but sing and dance along with Coach Dwana at your side.,3/24/2021,1,19:54,32,"19, 20","649, 1274, 901, 543, 999, 1275",https://open.spotify.com/playlist/0BqJrtMwNeufwTWPq20Nxa?si=8uP7XxcKQaSNSpZw_V_FxA,900,1346,"18, 92, 73, 68, 94, 97",classic,450,,,602
"Self Love ""Power and Grace""","Life is full of challenges and victories and in this workout with Coach Leanne, you'll celebrate your ability to embrace both. Expand your limits and lean in to Self Love on this high-intensity journey.",3/25/2021,3,25:51:00,25,"19, 21, 22","363, 237, 233, 168, 1122, 158",https://open.spotify.com/playlist/5nASwqj9vLB0VfYOFOmNjM?si=zKfyFXkOTge2pvbeepMTSw,937,4002,"34, 5, 60, 38, 11, 82",classic,953,,,508
"Meditation ""Opportunity""","It's your choice to take advantage of the moment. Find peace in the now. This meditation takes place on a beautiful glen in Glencoe, Scotland, following a snow.",3/28/2021,4,9:26,28,,,,969,0,,meditation,,,,0
Quick Hits Rap-ture,Get into the flow in this dreamy Pop Rap twofer.,3/28/2021,1,7:58,28,"19, 21","1165, 1133",https://open.spotify.com/playlist/7hhZ0fcfmOkZCAueBsLcTm?si=BO6LotDwSTij-_c78B5UWg,918,557,"16, 73",classic,155,,,145
Quick Hits Freedom Rock,Let your rebellious side show in this Classic Rock quick hit!,3/28/2021,2,10:16,33,20,"774, 554",https://open.spotify.com/playlist/3JmjsBQmh91bxJgXaUAVd6?si=RjwEnxGXSKuY4ngfGXVWcw,904,1322,"72, 48",classic,319,,,182
Quick Hits Rock Hard,"Thrash and smash to two high intensity Heavy Metal tracks! Warm up, jump in, and smash!",3/28/2021,3,12:10,25,20,"520, 1062",https://open.spotify.com/playlist/4TxFP5QN9e1wGNRDFpbPhr?si=wRa1uprzT0agsUHf2cz4qw,826,2317,"82, 54",classic,567,,,346
"Y2K Babyyy ""Jump Off Jam""",Jump off the couch and transport back to the 00s in this mix of Pop and Hip Hop. Coach Raneir is bringing the energy and style straight to you in this chilled-out low impact workout.,3/27/2021,2,25:36:00,27,"21, 23","374, 1141, 1287, 1322, 1323, 1111",https://open.spotify.com/playlist/1X1z2SZ0u7DI3cJLVTS75N?si=3mhpFI4hSNu2nBT1z1GcJg,897,2872,"37, 47, 13, 66, 63, 89",classic,880,,,1017
"Hoedown Throwdown ""Bless Her Heart""","Get your cowgirl boots on, this kickin' Country workout is the perfect confidence booster. Join Coach Leanne and stomp along to these bluesy songstresses as we Celebrate Women's History.",3/29/2021,2,17:19,25,25,"1285, 1278, 1279, 1280, 1281",https://open.spotify.com/playlist/02PyJaXbzHcW6sgZzZc1Qz?si=r7RMUGNSS5iYs9mYvUhdEw,906,1582,"6, 98, 91, 56, 34",classic,486,,,565
"Summer ""Diamonds""",Soak up the sun in this summery Pop workout! Join Coach Dwana and look inward on this journey to find your inner diamond and shine!,3/30/2021,1,20:07,32,19,"437, 1179, 1294, 1127, 272, 255",https://open.spotify.com/playlist/1m9b3hsSHXaaKzyn6yLw3t?si=cCGLxwN3S5CW4b85s4D0Ow,915,1457,"59, 66, 92, 27, 29, 95",classic,511,,,731
"Moment @ Yosemite National Park, California","Let this lush forest in Yosemite National Park soothe your senses and calm your mind. To enjoy this moment without music, hit the menu button on your left controller to adjust the volume. [Experimental]",3/29/2021,4,10:07,31,,775,,949,0,74,meditation,,,,0
"Superfreak ""Dedication""",Get on your dancing shoes - this throwback Soul playlist is the perfect mood booster. Honor the powerhouse female vocalists that shaped Soul and Disco as we Celebrate Women’s History.,3/20/2021,1,22:56,28,23,"1246, 508, 919, 297, 921, 510",https://open.spotify.com/playlist/2wPOyZ17TbtizHcANBCBdX?si=RHFKZXlOT4-yMQF7ju3GYA,886,1782,"17, 76, 65, 27, 67, 52",classic,591,,,783
"Skinny Jeans and Ripped Seams ""Ripped and Strong""",Listen as the worlds of Indie and Electronic collide in this mid-00s throwback. Dive into the avant-garde as we Celebrate Women’s History.,3/18/2021,1,16:55,32,22,"947, 1252, 1253, 1099, 1254",https://open.spotify.com/playlist/4X0PUWWxLf41tkhLq0584f?si=lr54fwLKTku2d-pQNUpBvA&nd=1,895,1098,"76, 48, 62, 89, 67",classic,387,,,559
"Strut ""The Journey""",Hit the road with Coach Raneir for a road trip playlist of 70s and 80s tracks. Hitch a ride on this West Coast road trip from North to South as we celebrate the journey along the way.,3/31/2021,3,24:16:00,27,20,"578, 1289, 1290, 1275, 1291, 1292",https://open.spotify.com/playlist/6X3vpOl52wPGOYZQl4XdwD?si=vGW1z4VHR5WaivHLIHSEMA,907,3443,"90, 44, 81, 18, 74, 54",classic,995,,,1020
Polka Till You Pop ,Dive into our newest genre debut! This Polish dance craze is the perfect pick-me-up to put a smile on your face and a pep in your step. Join your dance partner Coach Raneir in this polka-tastic workout!,4/1/2021,2,14:07,27,"22, 23","1301, 1295, 2134, 1298",https://open.spotify.com/playlist/7FdNGjZu9x2Bkf6ppcyuSL?si=tfcbTZTbQbqHo4LDdfyMNQ,921,1594,"50, 60, 67, 52",classic,576,,,858
"Moment @ Ytresand Beach, Norway","Melt into the calm waters of this beautiful beach in Norway. Sit down, focus on your breath, and take a moment. To enjoy this moment without music, hit the menu button on your left controller to adjust the volume. [Experimental]",3/15/2021,4,10:12,31,,1184,,816,0,93,meditation,,,,0
The Drop “Big Club Energy”,"Bring your ‘A’ game, athlete! These EDM bangers bring the heat and the club energy to you. Sweat it all out on the dance floor with Coach Leanne.",4/2/2021,3,17:24,25,22,"938, 611, 612, 613, 615",https://open.spotify.com/playlist/1u9NZhEqt9zF39Bs9miSEa?si=8nmmiO6SQuaGKIZz-kfXbA,813,3195,"77, 42, 65, 1, 79",classic,778,,,463
"Hip Hop You Don't Stop ""Feel the Flow""",Tap into your inner emcee flow with this chilled out playlist of 90s Hip Hop hits.,4/3/2021,1,23:25,28,21,"907, 865, 1077, 299, 295, 860",https://open.spotify.com/playlist/64i5dwgiv5tpnhwtWqh6AG?si=JNt09IDEQuCyRAoTIT6jhQ,870,1569,"62, 69, 75, 89, 58, 78",classic,522,,,695
"Meditation ""Playful""","Tap into that inner child and find the fun in living, breathing, and growing. The game of life is meant to be played on your terms. This meditation takes places in Milford Sound, The South Island of New Zealand.",4/4/2021,4,15:09,28,,,,970,0,,meditation,,,,0
Quick Hits Superfreak,Light up the dance floor with these two fiery throwback Funk tracks.,4/4/2021,3,9:12,27,23,"1174, 1163",https://open.spotify.com/playlist/1voGGnPgi3XCXOuAuMYAGb?si=gd4B-FDCTkueab2BzuQHlA,916,1329,"70, 5",classic,363,,,323
Quick Hits Y2K Babyyy,Flashback to Y2K with these two Electronic-inspired Pop tracks from the late 00s.,4/4/2021,2,9:09,32,"19, 22","474, 768",https://open.spotify.com/playlist/31b4MraQyyMyjRN7JoX2EI?si=bEH2sA_-RVaTbtebFMoPuQ,917,952,"13, 41",classic,317,,,422
Quick Hits Reggae Getaway,Enjoy this mini tropical vacation tuned to laid back Reggae classics.,4/4/2021,1,8:40,28,104,"1190, 1155",https://open.spotify.com/playlist/753SwVXBdW5oYR0tXl7r1R?si=KdxtJWt6Quq1nkOIYUV-5g,945,641,"64, 67",classic,163,,,116
"Take The Stage ""Jam Band Boogie""",Jam along to these epic live performances honoring the Jam Band greats! Noodle and riff to the beat as you sit front row for the Rock concert of a lifetime.,4/5/2021,2,22:59,25,20,"1024, 1316, 1317, 1318, 1319",https://open.spotify.com/playlist/5Qrwm89VDRvQkmJ9XiBHz6?si=YD-Utwz6Rp6WxjEZpEflBg,922,2637,"94, 87, 78, 29, 55",classic,686,,,527
"Just Dance “Pop, Drop & Dancehall”",Explore the sounds of Dancehall Pop with this high energy Jamaican-inspired dance party. Join Coach Doc as we grab a boombox and head to the dance hall!,4/6/2021,3,17:10,28,"19, 104","1315, 1310, 1312, 1153, 1313",https://open.spotify.com/playlist/01JvROoRPRK34JKcgIaf28?si=fpV2Esg5TUG1XSWAaVy6lw,923,2747,"99, 95, 27, 73, 54",classic,728,,,597
"Moment @ Machu Picchu, Peru","Enjoy the quiet mystery of Machu Picchu. To enjoy this moment without music, hit the menu button on your left controller to adjust the volume. [Experimental]",4/5/2021,4,10:08,31,,469,,999,0,9,meditation,,,,0
"Fresh Finds ""Indie Bounce""",Find your groove and sink into the vibe with these bouncey Indie Soul tracks. Let Coach Dwana show you the way on this tour of indie and upcoming artists packed with soul.,4/7/2021,1,24:11:00,32,"22, 23","924, 1306, 1051, 1307, 1308, 1309",https://open.spotify.com/playlist/4oybruebJXfHUhxY12KiDg?si=TeG3UeyDRNeex7ZCu1vfKQ,924,328,"45, 32, 60, 62, 77, 66",classic,103,,,126
"Break Up, Shape Up “Sun Comes Up”","Move up, move forward and move through that breakup with an upbeat Dance workout! Let it all out as you bust a move with Coach Dwana.",4/8/2021,2,21:24,32,22,"857, 1164, 375, 931, 797",https://open.spotify.com/playlist/32eHZDdNtFh2nAi2g63ztk?si=pMQCtsxeSASWuNB9hIJ5eQ,925,2408,"86, 33, 93, 46, 8",classic,634,,,507
"Super Monster ""Slay the Beast""",Prepare yourself... this all-Rock Super Monster is a beast! Slay your way through this 45-minute rager with Coach Mark. Can you make it to the other side unscathed?,4/9/2021,3,49:04:00,33,20,"1090, 957, 751, 849, 1095, 1321, 1257, 908, 1320, 568, 1105, 1231, 1161",https://open.spotify.com/playlist/4FvcDJejEWIY7ksB1MYYMx?si=V1UczT_LRXG9D3_EGzU9Sg,936,8189,"81, 37, 82, 74, 6, 87, 80, 56, 38, 20, 48, 79, 11",classic,2018,,,1268
"Self Love ""Honor Your Greatness""","Take a moment to recognize your self worth in this motivating Rock workout as we celebrate how great you are inside and out. Give back to your mind, body and spirit as you dig deeper with Coach Mark.",4/17/2021,1,26:05:00,33,20,"622, 317, 1097, 783, 1086, 976, 1088",https://open.spotify.com/playlist/0xT8lu7V9mUrz69WWeJIWC?si=cPj6vU6LS3m-lBZU2awwhA,942,1767,"9, 94, 75, 38, 6, 44, 79",classic,582,,,762
Quick Hits Hip Hop You Don't Stop,Prepare to flow with two uplifting Hip Hop tracks sure to boost your mood!,4/11/2021,1,10:40,25,21,"1077, 1080",https://open.spotify.com/playlist/3cRyvRxVbElfyHZl1XTEUC?si=KLoJT9qPQTuB1LFs1o3SRQ,852,723,"81, 61",classic,310,,,550
Quick Hits Retrofit,This 80s New Wave duo will lift your heart rate and your spirits.,4/11/2021,3,9:51,28,"19, 20","729, 727",https://open.spotify.com/playlist/4fX5q2OxenfxiiMyOEeXvL?si=fvcAFJ3USc-rTMNeHZrTSg,927,1531,"43, 97",classic,374,,,227
"Moment @ Great Wall of China, China","Bask in the setting sun atop the beautiful Great Wall of China. To enjoy this moment without music, hit the menu button on your left controller to adjust the volume. [Experimental]",4/12/2021,4,10:05,31,,74,,1000,0,17,meditation,,,,0
"Broken Dreams Team ""This Punk’s Feelin’ Lucky""","Feeling lucky, punk? Dive into this cross-decade Punk Rock mix for the ride of a lifetime. Get big, channel your inner angst, and let it all out with Coach Mark.",4/10/2021,1,17:21,33,20,"500, 1304, 149, 1305, 1209",https://open.spotify.com/playlist/2eA1P2eRO7fJXTkeEl78NB?si=W7DBG8rYSnuZnoEQJwlcMg,926,1186,"35, 51, 34, 98, 28",classic,373,,,452
Quick Hits Skinny Jeans and Ripped Seams,Strut your stuff in this uplifting mini Indie Rock workout.,4/11/2021,2,9:52,33,20,"378, 436",https://open.spotify.com/playlist/10shVxwtZX7LVLwWyhxB7o?si=8KkaU_VSSAeK3dKmRPk98g,928,1213,"90, 41",classic,325,,,275
"Cover Lover ""Tropical Adventure""",Say goodbye to winter and get ready to heat things up with Coach Raneir! Dive into these dancey Tropical House covers of classic Pop/R&B tracks for the perfect Low intensity workout.,4/14/2021,1,20:40,27,22,"400, 1328, 598, 1329, 1330, 1175",https://open.spotify.com/playlist/0zlhIq83hqdBpvb34r9MiC?si=kx2QpCi3S7urv8Al5ROcwg,939,1326,"69, 16, 5, 66, 95, 32",classic,472,,,690
"The Drop ""Future Tribal""",Get ready to move those hips! This hot Electronic workout uses Latin dance music fused with futuristic tribal house beats for the perfect dance workout.,4/13/2021,3,19:23,25,22,"1332, 1333, 1334, 1335, 1331",https://open.spotify.com/playlist/14PwJCYa4izCxUedLie10C?si=hGRcHAUmSQyBvNUK6nm5iA,938,3094,"45, 52, 73, 27, 60",classic,831,,,708
Meditation “Synchronized”,"Connect to the moment at hand. Learn from your surroundings, tap into your breath, and sync up with the world around you. This meditation takes places in Yuanyang Rice Terraces, China.",4/11/2021,4,8:30,28,,,,1003,0,,meditation,,,,0
"Mighty Musicals ""Debut""","Take your places, we're bringing you Musicals in a mighty way! Shine up those dancing shoes, these classic movie musicals will put you as the star from Hollywood's golden era.",4/12/2021,2,25:25:00,27,24,"1324, 1242, 1325, 1327, 1326, 1241",https://open.spotify.com/playlist/33ybXKTdxF8ylrM5rT9Uji?si=koncteGuRsajWZKkL-0ZNA,896,2782,"50, 92, 33, 80, 44, 72",classic,944,,,1291
"Strut ""Beat of Your Own Drum""",Take your workout performance to the next level in this pumped up Indie Rock workout. Build your self confidence and move to the beat of your own drum with Coach Dwana as your guide.,4/16/2021,3,21:05,32,"19, 20","762, 1339, 160, 744, 1340, 954",https://open.spotify.com/playlist/022Cuihb6mjaDccwpWVkOA?si=w9EfAjNqQxaDS2xXYoGVZg,941,3079,"90, 100, 68, 61, 70, 99",classic,779,,,545
"Game Time ""Head in the Game""","Get focused and keep your head in the game, athlete! Let this playlist of 00s Hip Hop be your anthem as Coach Doc pushes you to achieve greatness.",4/15/2021,2,23:54,28,21,"932, 1337, 1338, 1336, 880, 1166",https://open.spotify.com/playlist/4VmPWQ1jpCXIDWVmnNHGu6?si=jWm6C1JsTkWWIKZ-7bxO5g,940,3060,"58, 53, 91, 56, 84, 17",classic,914,,,1005
Quick Hits Sweaty Flannel,These two 90s Alternative Rock hits marry flow and mid-tempo energy for de-stressing in 10 minutes or less.,4/18/2021,2,8:26,33,20,"1048, 834",https://open.spotify.com/playlist/7yTBZPdPVIL8sxBd2bMw1T?si=HFN937XxTti1VBcUH7XD_w,959,797,"28, 35",classic,188,,,97
Quick Hits Summer,Get ready to get sweaty in the summer sun with this explosive Pop mini workout.,4/18/2021,3,8:01,28,19,"945, 394",https://open.spotify.com/playlist/7hEV5aDGyXT6qdK6haXsFk?si=NNHk8MdySp2xLSg4oxzjsw,958,1179,"93, 18",classic,291,,,183
"Meditation ""Reaction""","Identifying how you're feeling, why you're feeling it, and respecting your own emotional reactions is true self care. Give yourself that gift. This meditation takes place in Mount Shuksan, North Cascades National Park.",4/18/2021,4,9:04,28,,,,1023,0,,meditation,,,,0
Quick Hits Girl Power,Sink into these laid back 90s R&B tracks from powerhouse female artists.,4/18/2021,1,10:10,32,23,"646, 1091",https://open.spotify.com/playlist/4V8nt9zD46x4hPdWhNs2zm?si=VOGT5oNnTGqn5VPMx51sMg,960,649,"67, 65",classic,226,,,321
"Moment @ Matanuska Glacier, Alaska","Enjoy the solitude and peaceful stillness of Matanuska Glacier in Alaska. To enjoy this moment without music, hit the menu button on your left controller to adjust the volume. [Experimental]",4/19/2021,4,10:04,31,,1207,,1001,0,71,meditation,,,,0
"Breakout Role ""Mission: Unstoppable""","Hello, agents. Your mission, if you choose to accept it, is to be unstoppable! Join Coach Leanne as you move your body to these iconic spy themes from classic film and TV shows.",4/19/2021,1,15:00,25,20,"1353, 1354, 1005, 1356, 1355",https://open.spotify.com/playlist/2OTERo3r4L3mm5zAobaZ6h?si=RVVg6CDfQ2STDNDZAsiOpQ,961,137,"69, 100, 59, 80, 45",classic,59,,,104
"Punk You ""SKA’d 4 Life""","Dive into the mosh pit and brace yourself to be blown away! This mix of 90s SKA punk oscillates between calm and thrashing, just like the California waves.",4/20/2021,3,21:02,33,20,"1347, 1343, 1342, 1344, 1345, 1341",https://open.spotify.com/playlist/0NXpyhgfQGwVqNw7mXE3PI?si=NFX3jPMpRUiDMRjcWUMurQ,962,3337,"95, 78, 16, 64, 81, 61",classic,842,,,582
"Pop Till You Drop ""Dark & Dancey""",Dive into this upbeat Pop workout that's equal parts flow and fun! Supercharge your workout with leg lifts as we tour some of Pop's greatest super stars.,4/21/2021,2,18:45,27,19,"1349, 1293, 1350, 1032, 1519, 1352",https://open.spotify.com/playlist/3e7uCoKyJII5Y02y2KeU6A?si=8ZUy5OOjTx20pFFR89tm3A,963,1194,"62, 42, 40, 52, 67, 101",classic,448,,,699
"Super Monster ""1 Year Anniversary""","Gear up for a very special Super Monster to celebrate our one year anniversary! Whether you've been with us since day one or if its your first day, this energetic workout has something for everyone. Join ALL FIVE of our coaches as we celebrate together!",4/23/2021,2,41:48:00,22,"19, 20, 21, 22","950, 440, 916, 239, 1087, 934, 1122, 62, 417, 868",https://open.spotify.com/playlist/1I5yt2OuWARkMERBOgDpAi?si=Iu0h-0osT2-Erh967QBaBA,965,4971,"94, 44, 27, 67, 28, 79, 38, 82, 65, 101",classic,1365,,,1237
"Power ""No Prisoners""",Buckle up! We're bringing you the most intense and fast-paced Hip Hop workout to push you from beginning to end. Take no prisoners in this high intensity feat of power and skill.,4/24/2021,3,15:22,28,21,"1368, 818, 1112, 807, 1208",https://open.spotify.com/playlist/5ZNnfWAOGb7BQdIa83ErSE?si=gk4LKntWTHuahAdnHSVW-w,966,2764,"54, 3, 26, 1, 11",classic,682,,,429
"Mood Booster ""Earth Rocks""",Welcome Spring with this chill yet rockin’ mood booster as we tour the wonders of the natural world. This broad spectrum Rock workout will take you from South Africa to Mongolia with Coach Dwana as your guide.,4/22/2021,1,23:36,32,20,"1364, 850, 1366, 1367, 309, 1255",https://open.spotify.com/playlist/3Rli1O5EXcuCNAA3qulLSQ?si=jD_qg_hTTiexDwFlI7abow,964,1824,"74, 33, 87, 50, 8, 97",classic,560,,,651
"Jazz It Up ""Cool Cats""","Get ready, get cool, Coach Mark is taking you to Jazz school. This swingin' Jazz workout will have you jammin' and jivin' till the cows come home.",4/26/2021,2,16:34,33,23,"1370, 1372, 1371, 1374, 1373",https://open.spotify.com/playlist/6pG2D0zrS4FvcO0JDt4PoY?si=8lIVp2zuTLmt0_Jh1Xe6GQ,967,1441,"99, 41, 45, 89, 102",classic,446,,,526
"Pros Only ""Abs-o’licious""",Take it to the core in this explosive ab-focused Pros Only! Coach Leanne is bringing you super high BPM Electronic tracks and complex mapping patterns for a tighter core and an all-out dance party for the record books!,4/27/2021,3,20:47,25,22,"363, 1175, 1185, 996, 1187, 1186",https://open.spotify.com/playlist/5AoalExkEHEZ3MpE7Md8vW?si=9v-Uxs9qQuyfVP7eVkxkuA,851,3641,"76, 42, 3, 90, 79, 54",classic,908,,,601
"Guilty Pleasures ""Wonder of the 90s""",Hop into the shiny end of the 20th century with these 90s Pop Rock earworms. This cheery playlist is a total serotonin boost with tracks you just can't help but sing along to!,5/11/2021,1,24:58:00,27,"19, 20","466, 1415, 987, 1416, 793, 862",https://open.spotify.com/playlist/3YoRRwXPgc4jlfrpIOa7mi?si=n3BC_2PjTa6N-7wLAyvUYQ,994,1757,"47, 81, 50, 94, 99, 93",classic,571,,,732
Quick Hits Game Time,Hit the field with these two pumped up 00s Hip Hop confidence boosters.,5/9/2021,3,8:20,28,21,"879, 892",https://open.spotify.com/playlist/7i0ajYRhvHCIP8E1tWZ5on?si=yswqqbCbRK6YCYtUSkNmoA,989,1352,"103, 55",classic,328,,,191
Quick Hits Break Stuff,Need to let out some steam? These two energetic EDM tracks are the perfect power theme to break stuff to.,5/9/2021,2,9:34,27,22,"638, 232",https://open.spotify.com/playlist/6u2WjKhlUCKvv0nmPVPek9?si=f4_5sZOoRSqy7soResKwZw,990,953,"29, 13",classic,243,,,175
"Moment @ Xe Bang Fai River, Laos","Let the golden hues of the setting sun in Xe Bang Fai River in Laos warm your soul and calm your mind. To enjoy this moment without music, hit the menu button on your left controller to adjust the volume. [Experimental]",5/10/2021,4,10:06,31,,1237,,1028,0,64,meditation,,,,0
Nonstop K-Pop ,Join in on the worldwide phenomenon with our debut of Nonstop K-Pop! This sugary sweet Pop treat hails from South Korea for a pumped up workout. Dance your heart out with Coach Leanne as we Celebrate Asian American and Pacific Islander Heritage Month.,5/10/2021,2,15:54,25,"19, 104","1390, 1431, 1389, 1298",https://open.spotify.com/playlist/5dSq2KPOvJ57OshQXR8ADQ?si=aJx8ym5zQgiUCTGltLQExQ,984,1805,"32, 62, 68, 75",classic,548,,,623
Quick Hits Broken Dreams Team,Get ready for a mini Pop Punk angst fest with two rebellious throwback 00s tracks.,5/9/2021,1,8:20,27,20,"367, 687",https://open.spotify.com/playlist/4EJaM12IBWmA8UriuFeSLW?si=XTISy1VgQV6zs77rdNWX1w,991,518,"86, 63",classic,167,,,210
Fuego “Feel The Beat”,"Tour the sounds of some Mexican mega-stars from the 80s and 90s in this fun and dancey celebration! Warm up those vocal chords, Coach Doc is bringing the heat with this ultimate party playlist.",5/5/2021,2,18:26,28,,"1392, 550, 1394, 1393, 1395",https://open.spotify.com/playlist/39A8uxjHHvnqyEzTMGcGUz?si=hvqrm0hUQ16Uvsp0rydfKA,985,1914,"61, 102, 34, 87, 46",classic,604,,,739
"Meditation ""Giving Life""","Create new life in anything you do. Nurture and support your endeavors and passions by allowing love to guide the way. This meditation takes place in Isle of Skye, Scotland.",5/9/2021,4,9:25,28,,,,992,0,,meditation,,,,0
"Hip Hop You Don't Stop ""Take the Mic""",We’re throwing it back to the golden era of Hip Hop in this chilled out 90s and 00s playlist. Take the mic and bust a rhyme with Coach Doc!,5/7/2021,2,20:34,28,21,"1089, 1397, 859, 1396, 1398, 866",https://open.spotify.com/playlist/1toc8ZZjwduU1rZsUMKjF6?si=hFkVjZcYTxOEhtCFCV392Q,986,2238,"33, 60, 66, 77, 100, 54",classic,635,,,626
"The Drop ""Modern Mystic""",Get your dose of World music remixed to today’s hottest EDM beats with this fiery South Asian inspired dance workout. Join Coach Raneir as we heat it up in celebration of Asian American and Pacific Islander Heritage Month.,5/4/2021,3,23:54,27,22,"1401, 1407, 1402, 1404, 1403, 1405",https://open.spotify.com/playlist/1t6PSPVMgaCXhCjCDlsdDq?si=HXPOP9YDQaeLPBl6O0hEfw,993,3503,"53, 89, 66, 42, 1, 79",classic,971,,,901
"Skinny Jeans and Ripped Seams ""Want It All""",This cheery Indie Rock playlist carries a strong driving beat to drive the energy from start to finish. Join Coach Mark as we continue our celebration of Asian American and Pacific Islander Heritage Month.,5/6/2021,1,19:10,33,20,"1283, 1408, 1039, 1414, 1055",https://open.spotify.com/playlist/4xGeJvfaqKjRMOztckPCJv?si=sZSLOHtwTM25tQuxE0TKjw,988,1672,"37, 97, 28, 35, 90",classic,543,,,694
Rock The Ages “Rockin’ the Blues”,Take a tour of Blues inspired Rock with this broad spectrum Rock workout. Hop through time and get to rockin' with Coach Dwana as your tour guide.,5/8/2021,3,24:51:00,32,20,"1410, 1411, 1412, 1413, 642, 425, 1161",https://open.spotify.com/playlist/3RQ79G6ecTh4Jh36yyeTUj?si=VESegKuvTO2UgAJltuVvBA,987,3761,"6, 104, 58, 91, 56, 98, 84",classic,1013,,,869
"Moment @ Motu Rimatiai, Tetiaroa","Soak up warm tropical sunshine by rejuvenating water in the Polynesian atoll of Tetiaroa. To enjoy this moment without music, hit the menu button on your left controller to adjust the volume. [Experimental]",5/3/2021,4,10:04,31,,1226,,1025,0,73,meditation,,,,0
"Fitness Journey ""Streak Weeks Challenge""","Join us as we kick off our very first Supernatural Streak Weeks Challenge! Kick start a healthy routine and show up for a chance to win some cool prizes, including a video meet with your favorite Coach.",5/3/2021,1,23:01,25,"19, 22","941, 376, 109, 838, 799, 917",https://open.spotify.com/playlist/15Mf8XGOFadY0LITildqrn?si=iKJXUyQ_SHGa1ev5h0yi0A,983,1900,"13, 29, 18, 70, 59, 16",classic,495,,,384
"Meditation ""Never The Same""","Change is constant. Adaptation is key. Navigate change in your life and learn to embrace it as a new adventure. This meditation takes place in Ursa Beach, Portugal.",5/2/2021,4,8:17,28,,,,1034,0,,meditation,,,,0
Quick Hits Molten Rock,Get your motor runnin' with this mini contemporary Rock workout.,5/2/2021,1,9:46,33,20,"973, 395",https://open.spotify.com/playlist/6uDydJ9PHwtbgtzW5DYBAx?si=GNicmJpfQ5yG4srj8suJGA,981,747,"91, 56",classic,237,,,291
Quick Hits Just Dance,Get ready to flow with these two pumped up Pop tracks with a Latin dance inspired groove.,5/2/2021,2,7:21,28,19,"780, 64",https://open.spotify.com/playlist/0ht0JYTdf7zaUMtRjqhgKu?si=a3yx15gzR2qBlq4BXgaz9Q,980,759,"93, 5",classic,198,,,155
Quick Hits Punk You,Shout it out with these guitar-heavy 70s Punk Rock classics. Rock OUT and test your power in this short-but-not-so-sweet quick hit.,5/2/2021,3,8:01,25,20,"910, 909",https://open.spotify.com/playlist/3pFe8qvr41LEbFIKTnNVaR?si=fExM5Z7nQI2by-P6XzbJbQ,979,1387,"48, 20",classic,326,,,162
"Monster ""80s Rock God""","Grab your hairspray, this playlist packs huge 80's hits into a rockin' 30-minute package. Join Coach Raneir as you unleash your inner beast and enjoy yourself in the process. A Monster has never had hair this good!",5/1/2021,3,32:01:00,27,20,"1215, 1137, 1387, 264, 607, 729, 1388, 430",https://open.spotify.com/playlist/6UqBoPckzctetkjTzandMP?si=qwrzXJy0R2ekkSs-TEs4mQ,978,4524,"63, 6, 37, 79, 82, 80, 77, 47",classic,1286,,,1272
"Superfreak “Gotta Have That Funk""","Let loose and surrender to the groove with this mix of soulful 70's dance tracks. We've got the Funk to help get you out of any funk. Get ready to get sweaty, athlete!",4/30/2021,1,21:11,32,23,"767, 1176, 450, 555, 191, 970",https://open.spotify.com/playlist/0AVKpBSaTuGK2lfZIlYvUC?si=x0mjOaU4SYu3XgH-qD1skQ,1007,1793,"74, 8, 75, 44, 34, 78",classic,552,,,645
"Pop Till You Punk ""Mallrats""",Flash back to the 00s for this classic tour of Pop Punk. Tap back into your inner emo for this rockin' workout filled with heavy hitters.,4/29/2021,2,15:25,25,20,"711, 1378, 1379, 1380, 415",https://open.spotify.com/playlist/4js7nwLrXPONlENAQtrx0h?si=b0IDM5dgQmKs0vLRHQs6ew,976,2125,"55, 103, 86, 98, 72",classic,595,,,566
